product_category,product_name,product_short_desc,product_ad_desc,product_price,product_color,product_age,product_avg_rev
Rest room,FRIHETEN,est est consequuntur,Vitae doloribus qui autem veritatis odio architecto unde recusandae.,144,pink,18,1
Rest room,BALKARP,eligendi quaerat aut,Quis eaque laudantium non.,168,gray,19,2
Bed room,FRIHETEN,illo in illum,Accusantium iste aut eum voluptate dolorem ducimus animi.,364,pink,28,3
Bed room,EKEBOL,et maxime modi,Inventore consequatur id placeat quidem.,92,red,7,5
Rest room,BRATHULT,velit sunt deleniti,Et consequuntur magni qui est.,353,gray,9,1
Kitchen,DELAKTIG,nihil numquam sapiente,Consequatur quam et qui quis.,64,Skiftebo blue,22,3
Rest room,DELAKTIG,necessitatibus numquam sit,Ullam ut dicta maiores voluptas ipsum.,285,blue,17,3
Rest room,EKEBOL,velit asperiores eum,Officia eum et quis est.,388,white,11,5
Bed room,EKEBOL,pariatur neque quo,Dolor ut mollitia alias.,112,blue,12,2
Rest room,BRATHULT,quia velit at,Corporis vitae sint sit et.,493,Hyllie beige,28,1
Lobby,DELAKTIG,laborum earum earum,Iure officia dolores aliquam quaerat est quo cupiditate.,504,Skiftebo dark gray,27,3
Bed room,BALKARP,nesciunt aut totam,Sapiente rerum et.,582,white,6,5
Lobby,DELAKTIG,et fugit eum,Laboriosam et tenetur aut qui natus rem et eveniet amet.,595,navy,5,5
Rest room,BALKARP,eaque libero eum,Fugiat veniam voluptas architecto harum.,292,Hyllie dark gray,23,4
Rest room,BALKARP,vitae consectetur est,Cumque aut soluta commodi aliquam nihil iure eaque sint mollitia.,180,navy,10,2
Living room,BRATHULT,saepe dolorum modi,Pariatur sint dolore.,598,Bomstad black,1,4
Lobby,BALKARP,et perferendis officiis,Alias consequuntur omnis enim nisi quisquam id autem.,591,pink,27,5
Kitchen,BRATHULT,accusamus id voluptatem,Et enim aut reprehenderit ut neque expedita ducimus modi harum.,238,white,20,1
Living room,BALKARP,sit et saepe,Rem sit blanditiis placeat mollitia ut est blanditiis omnis modi.,647,red,11,3
Living room,BALKARP,molestias rem maiores,Sed placeat laborum ad vitae harum.,421,white,2,3
Kitchen,EKEBOL,esse animi veritatis,Laboriosam sint veniam et tempora quis molestias accusamus enim a.,349,Skiftebo dark gray,10,2
Bed room,BALKARP,repellat dignissimos itaque,Necessitatibus beatae ipsa.,193,Skiftebo blue,28,5
Lobby,BRATHULT,quo consequatur corporis,Corporis a in voluptatem.,271,black,23,4
Kitchen,EKEBOL,ducimus sed exercitationem,Facere est qui sed perferendis debitis quia architecto rerum.,37,Hyllie beige,26,1
Lobby,BALKARP,ipsam est maiores,Aperiam id libero eligendi consectetur rem non.,70,Bomstad black,15,5
Bed room,BRATHULT,numquam quia quos,Aut ipsam aut.,237,Hyllie dark gray,30,2
Kitchen,BRATHULT,perspiciatis reiciendis consequatur,Ab voluptatum atque at repellendus pariatur est et veniam numquam.,186,Skiftebo dark gray,3,2
Rest room,BALKARP,blanditiis consectetur magnam,Consequatur quibusdam quis dolore eos.,399,original red,14,3
Bed room,BALKARP,et natus illum,Dolorem distinctio impedit voluptatem ratione sint rerum.,318,gray,12,2
Kitchen,DELAKTIG,harum eveniet qui,Quaerat odio consequatur et.,599,Skiftebo dark gray,14,3
Bed room,BRATHULT,sint eum sit,Autem mollitia consectetur harum ipsa aut.,154,pink,13,4
Bed room,FRIHETEN,quia ut consectetur,Non neque mollitia.,288,Hyllie beige,13,1
Living room,FRIHETEN,qui vel officia,Debitis et neque.,175,Hyllie dark gray,25,4
Bed room,BRATHULT,reiciendis accusantium dolor,Qui sapiente voluptatum.,245,Skiftebo dark gray,17,4
Kitchen,BRATHULT,aliquam ad rerum,Blanditiis et atque perspiciatis aperiam voluptas sit laboriosam.,168,Bomstad black,14,1
Bed room,BRATHULT,maxime rerum consequatur,Nisi nisi non aut assumenda labore voluptatem dolorem eum sit.,123,white,18,2
Bed room,FRIHETEN,ipsum veniam rerum,Et quisquam vel omnis.,469,Bomstad black,27,1
Lobby,BRATHULT,omnis harum voluptas,Alias sunt voluptates eligendi veritatis.,19,red,19,5
Bed room,FRIHETEN,dolores et eveniet,Officiis ratione natus officia dolor doloribus qui.,177,black,23,4
Living room,DELAKTIG,omnis assumenda odio,Nihil sit in.,481,Skiftebo blue,16,2
Bed room,EKEBOL,non officia atque,Iusto consequatur esse distinctio id.,142,Bomstad black,30,4
Bed room,FRIHETEN,ullam voluptas harum,Ex non dolore veniam delectus dicta enim.,399,blue,8,2
Kitchen,BALKARP,laboriosam soluta qui,Esse modi quasi quia aut veniam deleniti suscipit velit.,450,black,30,2
Lobby,DELAKTIG,blanditiis similique earum,Temporibus vitae quidem explicabo eum dolorem.,233,Bomstad black,14,1
Bed room,BRATHULT,quo modi aliquam,Ex odit veritatis velit libero.,74,Hyllie dark gray,4,1
Rest room,DELAKTIG,amet qui necessitatibus,Alias illo molestiae doloribus.,346,white,26,5
Lobby,FRIHETEN,et ut ut,Nesciunt illo est maxime dolorem rerum delectus.,630,blue,29,2
Living room,BALKARP,qui aut quia,Sint quibusdam ratione quia laudantium.,664,blue,30,5
Bed room,BRATHULT,libero nobis quo,Alias consequatur veritatis ut.,517,pink,9,5
Living room,DELAKTIG,itaque voluptatem tempore,Magni sint inventore.,260,navy,1,3
Kitchen,BALKARP,hic culpa reiciendis,Eum dignissimos odio molestias.,180,original red,28,3
Kitchen,DELAKTIG,adipisci quae consequatur,Suscipit quas velit natus veniam nulla.,341,pink,24,5
Kitchen,BALKARP,illum unde quis,Ratione iusto distinctio eum ut earum ex.,276,white,19,1
Lobby,DELAKTIG,dolores ab perspiciatis,Non illo itaque.,56,Hyllie beige,17,4
Lobby,FRIHETEN,aut et est,Sit quos voluptatibus quis voluptatem ea illo omnis.,587,original red,18,2
Kitchen,EKEBOL,velit molestias eaque,Sit quia perferendis error ullam dolor vel rerum nisi.,311,Hyllie beige,1,4
Lobby,FRIHETEN,non qui incidunt,Non autem facere veritatis tempore quae adipisci rerum.,327,black,4,2
Lobby,BRATHULT,ipsum quod est,Aut nemo sit nihil architecto eos et.,426,Hyllie dark gray,16,3
Living room,FRIHETEN,et rerum sapiente,Asperiores aut ex tempore voluptatem.,377,red,12,4
Lobby,BRATHULT,est ut non,Harum nostrum expedita laboriosam aperiam quibusdam.,629,Bomstad black,11,1
Lobby,DELAKTIG,harum dolorem pariatur,Quo aut vitae.,394,original red,26,3
Lobby,DELAKTIG,vitae facilis vel,Explicabo excepturi accusamus sit.,558,black,20,4
Lobby,EKEBOL,cumque placeat earum,Non sed blanditiis odio quos nihil corrupti dignissimos saepe.,79,blue,14,1
Kitchen,BALKARP,rerum id nesciunt,Beatae amet eveniet facere pariatur consequuntur dolores.,402,Bomstad black,3,1
Kitchen,BALKARP,id nemo nesciunt,Quis ipsa consequatur reprehenderit distinctio consequatur tenetur.,158,navy,27,4
Kitchen,EKEBOL,placeat beatae soluta,Optio in rerum et quam ad molestiae consectetur iste.,170,Hyllie dark gray,15,3
Lobby,DELAKTIG,facilis et veritatis,Dolor cupiditate voluptatem et est.,107,Hyllie beige,29,3
Rest room,FRIHETEN,voluptatem omnis ut,Qui esse nesciunt veritatis quis dolor minus.,583,original red,5,4
Living room,EKEBOL,harum aut sit,Necessitatibus perspiciatis quos cumque.,557,Skiftebo blue,23,4
Rest room,EKEBOL,omnis veniam fugit,Aut neque et et libero sunt quasi ipsa id quam.,46,red,18,4
Rest room,FRIHETEN,laborum aliquam adipisci,Suscipit reiciendis illum voluptatibus consequuntur nam inventore.,209,Hyllie dark gray,17,4
Lobby,BALKARP,magnam sed mollitia,Molestias maiores repellat rerum voluptatem incidunt consequatur iure facilis earum.,452,Skiftebo blue,9,5
Rest room,EKEBOL,autem tenetur sunt,Minima tempore reprehenderit est explicabo saepe ea tempore vero a.,492,Skiftebo dark gray,24,5
Rest room,EKEBOL,voluptate fugit provident,Sit pariatur ut voluptatem voluptatem harum et distinctio et.,129,black,6,3
Lobby,DELAKTIG,officiis veritatis qui,Aliquid sit quo neque ratione.,58,red,15,5
Lobby,DELAKTIG,sit et deserunt,Non omnis reiciendis deleniti at dolore nisi neque eum temporibus.,430,white,15,1
Kitchen,DELAKTIG,omnis corrupti a,Sint et omnis placeat qui.,653,Hyllie dark gray,27,2
Living room,DELAKTIG,veniam esse aut,Quisquam aspernatur quis sed laudantium et nostrum.,448,Skiftebo dark gray,6,4
Living room,DELAKTIG,rem qui quia,Est autem dolore similique repellendus voluptatem.,194,Hyllie beige,11,2
Rest room,EKEBOL,possimus dolorem aut,Quia ut aliquid aliquam commodi aliquid eos sunt ipsa.,32,gray,8,4
Lobby,BALKARP,architecto voluptate ipsa,Omnis non nihil et.,545,Hyllie beige,18,5
Kitchen,DELAKTIG,quas consequuntur ut,In quia animi maiores accusamus similique modi ullam molestiae.,428,pink,20,4
Living room,EKEBOL,sint illum veniam,Qui quibusdam ipsum.,623,Skiftebo blue,3,3
Kitchen,DELAKTIG,maxime ipsa qui,Officiis natus accusamus praesentium libero aliquid eaque sint quo aut.,126,gray,29,5
Lobby,EKEBOL,nisi sed autem,Perspiciatis nobis facilis aperiam voluptates quisquam tempore unde et.,469,blue,8,3
Bed room,EKEBOL,quis ea doloremque,Necessitatibus voluptates molestiae quam nisi ullam nostrum.,201,Skiftebo dark gray,19,1
Living room,DELAKTIG,aut cum est,Eveniet nisi necessitatibus.,501,red,2,5
Bed room,BALKARP,aliquid ut placeat,Voluptas numquam deleniti eveniet natus molestiae nesciunt consequatur qui.,418,red,2,3
Rest room,BRATHULT,tempore similique voluptate,Minus eos ut nam et fugiat tempore.,270,gray,24,1
Bed room,BALKARP,maxime placeat voluptatem,Sint autem aut quia sed.,22,black,5,3
Bed room,BRATHULT,quia vel aliquam,Nemo alias fuga.,572,Hyllie beige,18,5
Lobby,FRIHETEN,et sint molestiae,Quia et quisquam molestiae harum accusamus.,232,pink,2,4
Lobby,EKEBOL,labore eos error,Facilis in voluptatum modi et aut consequuntur.,382,Skiftebo blue,29,2
Living room,DELAKTIG,quam et perferendis,Maxime commodi occaecati ab necessitatibus maxime facere vel magni.,208,Hyllie dark gray,25,2
Living room,BALKARP,debitis non consequatur,Voluptates ut excepturi a.,219,gray,12,4
Lobby,EKEBOL,non harum et,Quasi tenetur aliquid fuga et ea doloremque quia delectus.,324,original red,17,2
Bed room,BRATHULT,nulla quia qui,Dolorem eligendi autem quod nulla exercitationem eum architecto.,504,white,3,2
Rest room,FRIHETEN,consequuntur sequi quis,Blanditiis sunt consequatur rerum eum.,366,Hyllie dark gray,4,3
Kitchen,DELAKTIG,eos iste nostrum,Ratione hic et non et mollitia dolorum facilis quia.,92,pink,6,3
Lobby,FRIHETEN,alias nemo aut,Aut consequatur est magnam molestiae ut ut non.,448,original red,26,1
Living room,BALKARP,aut nam distinctio,Inventore ut voluptates deserunt est corrupti aut.,213,Hyllie beige,16,3
Kitchen,DELAKTIG,sapiente dolor tempora,Voluptatem repellat eveniet aut.,178,navy,15,4
Bed room,DELAKTIG,est fugit dolorem,Unde natus optio deserunt.,267,Bomstad black,10,4
Lobby,FRIHETEN,mollitia quis omnis,Ab est sit perferendis suscipit ut.,148,red,14,4
Rest room,DELAKTIG,qui inventore quasi,Eos ratione quia omnis nisi voluptatibus aspernatur aut ullam enim.,484,gray,16,3
Rest room,EKEBOL,earum neque ad,Libero sunt ut nihil consequatur quia blanditiis.,277,Hyllie dark gray,14,4
Kitchen,DELAKTIG,voluptas iusto temporibus,Commodi quia voluptate culpa eum asperiores quo reiciendis aut qui.,121,pink,30,5
Bed room,DELAKTIG,voluptatem laudantium dolores,Est veniam debitis libero et.,578,original red,16,1
Lobby,BALKARP,ut delectus omnis,Asperiores dolor et at aliquid.,130,Hyllie dark gray,22,2
Rest room,DELAKTIG,ut minus beatae,Est temporibus inventore unde veritatis.,87,red,15,4
Bed room,FRIHETEN,sequi vel saepe,Consectetur debitis rerum et.,387,blue,1,1
Living room,BRATHULT,voluptates rerum ab,Corrupti itaque rerum error aliquid reprehenderit illum sint.,238,gray,1,3
Kitchen,BALKARP,iste velit aut,Voluptatibus praesentium dolores voluptas quidem modi qui eveniet et placeat.,262,Skiftebo dark gray,1,2
Living room,FRIHETEN,ea maxime nulla,Cumque dicta quaerat.,507,Skiftebo blue,30,1
Bed room,DELAKTIG,amet non iusto,Iure eius sint omnis amet sit culpa dolores.,196,black,19,2
Rest room,BRATHULT,culpa at et,Tempore reiciendis et laudantium corrupti nihil ut accusamus sit deserunt.,181,Hyllie beige,17,2
Bed room,DELAKTIG,deserunt blanditiis dolorem,Aut et et cumque velit possimus minima animi tenetur.,339,Skiftebo dark gray,8,2
Kitchen,BALKARP,tenetur iusto nisi,Voluptatibus iure culpa sed dolor alias culpa provident distinctio.,623,Skiftebo blue,10,3
Bed room,EKEBOL,et cumque beatae,Reiciendis quis quo similique exercitationem excepturi voluptas molestias suscipit sequi.,32,Hyllie dark gray,30,1
Rest room,DELAKTIG,reiciendis doloremque ut,Aliquid et repudiandae nihil et sit blanditiis laborum.,481,blue,28,1
Kitchen,EKEBOL,sint totam sed,Consequatur et amet.,86,original red,13,4
Living room,FRIHETEN,eaque rem soluta,Asperiores ut molestias architecto cum.,320,blue,25,3
Kitchen,FRIHETEN,voluptatum rem provident,Iste tempore dolores non ut ducimus voluptas possimus facilis.,14,white,29,5
Lobby,BRATHULT,qui facilis voluptatem,Quod qui dolor omnis sint sit consequatur quam hic.,343,blue,1,3
Kitchen,BRATHULT,tenetur voluptatum excepturi,Ipsam fuga consequatur fugiat quisquam ex.,46,blue,11,4
Bed room,BRATHULT,velit quo debitis,Qui minima repudiandae delectus soluta iusto.,111,original red,28,1
Living room,EKEBOL,error temporibus nisi,Natus doloremque autem doloremque rerum totam aliquam beatae.,430,gray,13,1
Kitchen,DELAKTIG,delectus illo nihil,Doloribus qui rerum consequatur quia.,171,Bomstad black,10,1
Lobby,EKEBOL,quaerat et velit,Explicabo ut ut necessitatibus commodi sit.,630,Hyllie dark gray,5,4
Bed room,BALKARP,officiis molestias quo,Repellendus inventore dolor dolores eius.,424,navy,12,3
Kitchen,DELAKTIG,ut repellendus placeat,Deleniti eum nulla est labore qui laudantium error.,587,Skiftebo blue,6,4
Bed room,BRATHULT,facere facilis quisquam,Enim sint perspiciatis ad labore eum fuga placeat laudantium.,590,original red,15,4
Bed room,BALKARP,veniam magnam incidunt,Eaque eos et reiciendis suscipit autem.,65,Hyllie dark gray,13,3
Living room,FRIHETEN,cupiditate maxime blanditiis,Molestiae quibusdam quo.,180,Skiftebo blue,16,5
Lobby,DELAKTIG,ab modi et,Velit placeat sint tempore quisquam soluta omnis consectetur debitis.,232,white,9,2
Rest room,FRIHETEN,a saepe error,Aperiam quos nesciunt magnam ipsam.,646,black,27,4
Bed room,BALKARP,aut consequatur est,Doloribus delectus et.,480,blue,3,3
Rest room,DELAKTIG,quo repellat quisquam,Nobis voluptatem voluptas omnis assumenda fuga consequatur molestiae laudantium voluptas.,597,Hyllie dark gray,18,5
Lobby,BALKARP,cupiditate saepe blanditiis,Pariatur voluptate similique nulla vitae repellat vel dolores qui nam.,343,black,10,1
Kitchen,DELAKTIG,fuga illo numquam,Voluptatum nostrum sapiente adipisci.,569,gray,13,2
Kitchen,BALKARP,voluptas nihil et,Exercitationem et dolores cupiditate laboriosam omnis.,163,gray,6,3
Kitchen,FRIHETEN,odio culpa accusantium,Architecto et vel sunt cupiditate id illo.,368,original red,4,1
Living room,DELAKTIG,dolor facilis dolores,Ut iste ratione quis enim dolores qui est possimus rerum.,534,pink,22,4
Kitchen,BRATHULT,nihil praesentium non,Ut odit voluptas qui voluptatem qui vel error quas.,206,Skiftebo dark gray,18,2
Bed room,FRIHETEN,velit vitae nam,Unde amet quis consequatur quibusdam assumenda nostrum ex molestias aut.,283,original red,4,2
Kitchen,DELAKTIG,et eum cupiditate,Et dolores et dignissimos.,505,Bomstad black,25,1
Bed room,FRIHETEN,autem voluptatem magni,Provident voluptates corrupti qui aut magnam placeat.,300,blue,21,5
Living room,DELAKTIG,aut neque nesciunt,In ut exercitationem et unde voluptate dolor aut.,130,navy,15,4
Living room,FRIHETEN,quo perferendis et,Minima qui pariatur hic architecto corporis aut et in minus.,331,navy,7,2
Lobby,BALKARP,quis numquam ut,Est vitae et occaecati voluptatem ex provident qui libero.,77,black,26,5
Lobby,BALKARP,at ut fugiat,Soluta consequatur doloremque est ut illum consequuntur accusamus quia.,94,black,13,3
Living room,EKEBOL,voluptas veniam aut,Dolor sit perspiciatis ut ut et voluptas.,576,blue,16,4
Kitchen,FRIHETEN,nemo libero aut,Adipisci qui occaecati in sunt officiis expedita ad.,418,Hyllie beige,18,1
Bed room,EKEBOL,tempora id distinctio,Rem esse ipsa repudiandae.,552,black,10,1
Rest room,DELAKTIG,non cumque modi,Dolores tempore doloremque molestiae quas doloribus blanditiis pariatur.,38,white,26,1
Kitchen,EKEBOL,impedit minus ut,Distinctio vel aut natus ullam ullam nemo.,379,Skiftebo dark gray,3,5
Lobby,BRATHULT,velit quibusdam ea,Voluptas sit dolor debitis.,547,Skiftebo blue,20,1
Rest room,BRATHULT,exercitationem qui consectetur,Velit rem sunt maxime doloribus corrupti.,44,red,25,2
Bed room,FRIHETEN,dolorem delectus perspiciatis,Placeat et et earum.,446,navy,20,2
Lobby,FRIHETEN,pariatur veniam consequuntur,Qui sint vero voluptas.,456,white,19,2
Kitchen,FRIHETEN,rerum sunt praesentium,Qui sit nulla numquam iure eius magnam ad.,176,original red,11,2
Lobby,FRIHETEN,ut cupiditate magni,Ipsum inventore non ipsam quibusdam amet dolor exercitationem voluptas.,534,black,15,5
Living room,EKEBOL,maiores nam possimus,Inventore quos quia.,173,Skiftebo blue,22,1
Bed room,EKEBOL,excepturi debitis voluptatem,Atque maiores perspiciatis atque at rerum est.,296,Hyllie beige,8,5
Rest room,BRATHULT,in quas corporis,Harum impedit expedita.,573,blue,10,5
Kitchen,DELAKTIG,fugit corporis placeat,Ex aut omnis et voluptatem deleniti.,572,gray,17,2
Lobby,BALKARP,quis velit necessitatibus,Possimus dolorem est minima incidunt et.,159,navy,29,3
Lobby,DELAKTIG,adipisci qui placeat,Ut molestiae deserunt quis aut dolor dolores in perferendis.,42,pink,29,3
Lobby,DELAKTIG,rem distinctio dolorem,Mollitia inventore pariatur animi velit laborum voluptatem perferendis nobis.,543,red,29,3
Living room,BRATHULT,sed molestiae corrupti,Nemo sunt totam modi reprehenderit ut repudiandae.,367,black,27,5
Bed room,FRIHETEN,porro est aliquid,Et cum suscipit.,483,pink,24,5
Kitchen,EKEBOL,aut delectus architecto,Saepe unde sint sed inventore consequatur.,528,red,6,1
Rest room,BALKARP,numquam est ut,Dolorem officia labore voluptas voluptatum ullam.,38,original red,17,1
Lobby,FRIHETEN,pariatur tempore nostrum,Commodi possimus recusandae.,228,Bomstad black,4,1
Living room,FRIHETEN,odio dolores et,Quos assumenda voluptatum iure.,70,red,2,4
Lobby,EKEBOL,at ullam voluptates,Non nihil similique vitae enim necessitatibus nobis.,613,pink,7,5
Lobby,EKEBOL,doloremque neque rerum,Sit est unde voluptas ut consequatur.,415,pink,19,5
Kitchen,DELAKTIG,nostrum et ut,Totam quisquam qui.,428,Hyllie beige,20,3
Lobby,BALKARP,laudantium fugit ea,Enim sed omnis et.,153,black,16,4
Rest room,BRATHULT,vero aspernatur porro,Ut iste vero et.,625,red,28,2
Kitchen,EKEBOL,fugit velit quod,Magnam dolore placeat aut recusandae.,663,Skiftebo blue,4,1
Lobby,EKEBOL,quis sequi nemo,Similique quis et libero id consequatur.,110,original red,10,3
Living room,EKEBOL,dolores ea neque,Commodi ea ea error quia saepe adipisci.,364,black,2,1
Kitchen,BALKARP,rerum at eos,Doloremque eaque rerum quaerat consequatur sed rem dolores esse.,424,Bomstad black,13,5
Living room,DELAKTIG,et voluptatum voluptatem,Facere ea eum blanditiis repellat eos consequuntur pariatur.,446,pink,22,1
Bed room,FRIHETEN,perferendis explicabo eos,Minima explicabo dicta velit maxime non exercitationem odit ut optio.,395,pink,3,1
Lobby,BALKARP,dolorem repudiandae dolorem,Voluptatibus expedita ea ullam numquam sed.,247,white,16,4
Lobby,DELAKTIG,provident assumenda ut,Itaque cumque labore et repellat id in voluptatibus.,181,black,7,5
Living room,BALKARP,dignissimos est ex,Voluptatem alias voluptas.,359,Skiftebo dark gray,27,3
Kitchen,DELAKTIG,nemo quia repellendus,Saepe adipisci a ab quod unde consequatur quo corporis.,82,black,8,5
Bed room,EKEBOL,rerum dignissimos ea,Iure nesciunt distinctio consequatur architecto nisi officia aspernatur ipsam.,363,Bomstad black,6,4
Living room,BALKARP,aut necessitatibus ut,Ut cumque voluptatem id.,612,black,8,3
Lobby,BALKARP,placeat officia id,Dolore et ab quidem magni aut dicta.,459,pink,20,4
Kitchen,EKEBOL,ullam error voluptatem,Aut eum non et delectus ut voluptas incidunt.,521,Hyllie beige,28,5
Rest room,EKEBOL,officia eos nobis,Ipsum sit quo ut cum qui excepturi fuga laborum qui.,257,original red,24,5
Kitchen,EKEBOL,qui voluptatem pariatur,Ea et ipsa ut fugiat perferendis at beatae corporis.,513,blue,26,4
Rest room,FRIHETEN,magni libero libero,Nesciunt amet eum consequatur ut et.,576,red,8,5
Rest room,DELAKTIG,iure atque minima,Quod totam dolores ea ratione sunt ex facilis et in.,225,Skiftebo blue,11,1
Rest room,EKEBOL,quasi ut quidem,Quibusdam sapiente atque et natus illum.,173,red,19,1
Lobby,BALKARP,vitae animi dolore,Qui ex voluptatum consequatur perferendis nam repudiandae quis rerum et.,577,red,18,5
Kitchen,BRATHULT,nisi incidunt eos,Voluptates voluptate quae eveniet in deserunt modi in tenetur.,658,blue,12,3
Kitchen,BRATHULT,veniam impedit est,Unde ut non ut.,446,original red,11,3
Living room,BALKARP,non occaecati suscipit,Molestiae assumenda quo qui.,112,white,17,1
Lobby,EKEBOL,dicta consequuntur dolorem,Vel quod facilis natus doloribus nobis nostrum.,285,navy,16,4
Lobby,DELAKTIG,tempora aliquam ratione,Quia consequatur laboriosam ducimus animi est neque perferendis illum magni.,121,gray,20,3
Kitchen,DELAKTIG,eos earum autem,Iste ut quia eveniet fugiat ut recusandae.,186,Bomstad black,14,1
Lobby,BRATHULT,rerum quibusdam omnis,Veritatis voluptatum eveniet perferendis deserunt magnam quasi velit cum perferendis.,505,Skiftebo dark gray,22,1
Rest room,DELAKTIG,quos nostrum eligendi,Nobis dolores quos eaque in magni voluptatem.,321,pink,7,5
Bed room,BRATHULT,quis quo aperiam,Placeat fugit aut qui deleniti dolores doloribus aliquid.,646,Skiftebo blue,5,4
Living room,BALKARP,et sunt non,Temporibus molestiae iure assumenda error.,560,white,2,5
Lobby,FRIHETEN,facilis qui aut,Eum vitae facilis autem repudiandae ut voluptatem qui magnam aut.,647,Bomstad black,27,2
Bed room,FRIHETEN,fuga quo dolor,Ipsa amet iusto et saepe nam quia non quam accusamus.,193,Bomstad black,25,4
Bed room,BRATHULT,sed qui ut,Eius unde facilis dolorem sequi vitae eum voluptatem fuga cumque.,24,Hyllie dark gray,3,2
Bed room,DELAKTIG,non est et,Consequatur dignissimos qui.,258,Bomstad black,24,2
Living room,FRIHETEN,dolor ducimus omnis,Minima est et ullam velit tempore vero consequatur repellat.,287,gray,25,5
Bed room,FRIHETEN,similique vitae dolorem,Neque dignissimos facere quibusdam qui sunt dolorem impedit.,343,navy,2,4
Bed room,BRATHULT,ipsum placeat quaerat,Adipisci pariatur non.,507,original red,24,4
Rest room,BALKARP,ipsa doloremque iure,Eius et repudiandae ex officia omnis a fugit nesciunt dicta.,652,Bomstad black,30,5
Bed room,EKEBOL,ea libero praesentium,Beatae accusantium et vero commodi.,160,Skiftebo blue,5,3
Kitchen,EKEBOL,molestias rerum asperiores,Excepturi minus fuga.,130,black,5,3
Kitchen,BRATHULT,harum eos ut,Quas corrupti nihil.,543,Hyllie dark gray,17,3
Living room,DELAKTIG,alias magnam aut,Eum magni reprehenderit magnam quod labore incidunt accusantium.,397,navy,15,3
Kitchen,BALKARP,asperiores harum nihil,Qui doloribus id amet nesciunt maxime omnis repudiandae hic sed.,430,white,11,4
Living room,EKEBOL,debitis est id,Mollitia inventore ratione accusantium ex enim maxime aperiam.,327,blue,24,1
Kitchen,FRIHETEN,voluptatem ab voluptas,Laudantium dolor corporis nam dolores.,388,navy,7,2
Lobby,FRIHETEN,voluptas tenetur alias,Ducimus est quod repellat qui.,161,Skiftebo blue,26,3
Kitchen,BRATHULT,sed inventore enim,Dolore dignissimos illum sed ullam qui.,312,gray,21,4
Kitchen,BRATHULT,ea ut itaque,Quas corrupti corrupti molestiae et et explicabo et aut nihil.,50,Bomstad black,23,4
Lobby,EKEBOL,est nemo neque,Ut illum iusto qui harum aut aut laudantium similique.,172,original red,5,3
Living room,FRIHETEN,et sit sed,At repellat ut tempora nisi illo labore in dolores.,54,pink,7,3
Kitchen,EKEBOL,ab culpa perferendis,Sit accusantium omnis aut rerum doloribus.,41,gray,27,2
Bed room,FRIHETEN,ad asperiores et,Consequuntur voluptatem veniam facere voluptates aut veritatis reiciendis et.,405,white,22,2
Kitchen,BRATHULT,et ipsa et,Debitis cum ad quia amet accusantium ducimus ut ut autem.,500,white,17,5
Rest room,DELAKTIG,qui natus enim,Inventore rerum vel nobis perferendis officia.,458,red,23,4
Bed room,BRATHULT,dignissimos eos commodi,A dolorem omnis rem distinctio pariatur et quia.,40,white,28,2
Bed room,DELAKTIG,saepe culpa necessitatibus,Id reprehenderit praesentium officiis commodi culpa aut eligendi perspiciatis porro.,428,original red,13,2
Bed room,BALKARP,eligendi accusamus excepturi,Aliquam quo est voluptatibus accusantium fuga.,321,black,19,1
Bed room,EKEBOL,iure sed sint,Provident numquam molestiae et.,275,pink,19,5
Living room,FRIHETEN,aut quia cupiditate,Enim ea aut culpa voluptate dicta voluptates totam.,496,gray,4,1
Bed room,BRATHULT,dolorem repellat autem,Et asperiores fugiat quod praesentium at modi quis facere.,415,navy,22,5
Rest room,EKEBOL,aut dolores deserunt,Reprehenderit rerum doloribus sequi itaque et.,180,blue,3,4
Rest room,DELAKTIG,rerum molestiae qui,Omnis sequi assumenda itaque odit.,419,Hyllie beige,27,3
Bed room,EKEBOL,quibusdam quas ut,Omnis voluptatem est illo neque beatae voluptatem beatae excepturi.,662,navy,14,5
Bed room,BRATHULT,magnam enim facere,Laborum porro mollitia quaerat dolorum voluptatem reprehenderit.,644,original red,22,4
Lobby,BRATHULT,quos perferendis sit,Velit quis autem non aspernatur mollitia quasi quo.,614,red,29,2
Lobby,DELAKTIG,quas et ipsam,Consequatur molestias dolorum quo est voluptatem et quia.,526,Hyllie dark gray,11,3
Bed room,EKEBOL,quis dolor doloribus,Dolores quo velit libero.,451,Hyllie dark gray,21,2
Living room,FRIHETEN,vel quia illum,Esse et voluptas iusto quaerat et.,453,navy,29,3
Rest room,DELAKTIG,quis in sequi,Impedit laboriosam sint.,363,Hyllie dark gray,23,1
Lobby,BALKARP,aut doloribus et,Quos hic modi est voluptas consequuntur molestiae exercitationem.,451,black,2,1
Kitchen,EKEBOL,esse cupiditate consequatur,Ut nobis aut repudiandae nostrum.,414,Skiftebo blue,7,5
Lobby,BALKARP,veritatis delectus id,Minima tempore nostrum explicabo sed tempore ea autem.,383,red,14,1
Kitchen,DELAKTIG,ad suscipit in,Assumenda dolorum rerum mollitia.,58,blue,5,5
Living room,DELAKTIG,molestiae aspernatur tempore,Consequuntur non nihil neque dolores consectetur distinctio aut ut quo.,370,Hyllie dark gray,18,3
