product_category,product_name,product_short_desc,product_ad_desc,product_price,product_color,product_age,product_avg_rev
Rest room,BALKARP,repudiandae perferendis aut,Sed similique voluptas sunt sit rerum nisi qui maxime.,176,original red,4,1
Lobby,BRATHULT,numquam sunt est,Est reprehenderit modi.,429,Hyllie dark gray,6,5
Lobby,FRIHETEN,dolores laudantium quod,Porro porro possimus sunt maxime.,16,Skiftebo blue,17,4
Rest room,EKEBOL,omnis aut itaque,Expedita et sed eius totam iste tempora beatae officia.,172,Bomstad black,17,2
Kitchen,BALKARP,quaerat suscipit dolorem,Delectus aut nobis est porro commodi consequuntur quisquam dolorem eum.,256,gray,12,5
Living room,BALKARP,nesciunt consequatur dolorem,Quisquam hic quos cum facere et nisi voluptas id.,364,red,21,5
Lobby,FRIHETEN,quod atque consectetur,Voluptas velit praesentium.,654,gray,15,2
Kitchen,EKEBOL,ducimus et nihil,Fuga voluptatem numquam iusto aut maxime.,23,red,15,5
Living room,BALKARP,cumque accusantium et,Sunt iure cupiditate enim mollitia eligendi voluptas fugiat voluptas.,98,Bomstad black,25,3
Kitchen,BALKARP,dolor vel sed,Placeat accusantium sed praesentium dolorem voluptatibus.,181,navy,3,2
Living room,EKEBOL,exercitationem consectetur recusandae,Aperiam qui aut inventore veniam vero.,292,original red,7,4
Living room,BRATHULT,enim velit consequatur,Voluptatibus temporibus ipsa voluptas quisquam pariatur quia debitis est.,452,Skiftebo blue,6,2
Bed room,BALKARP,enim deleniti et,Tempore doloribus rerum perferendis dolorem sed explicabo consectetur omnis delectus.,296,blue,9,3
Kitchen,DELAKTIG,accusamus quibusdam libero,Exercitationem est ea aut accusantium iusto et praesentium.,514,Hyllie beige,24,2
Living room,BRATHULT,rerum ut perspiciatis,Laudantium omnis ipsum minus expedita corrupti quis ratione voluptas.,201,Skiftebo dark gray,3,5
Kitchen,BRATHULT,consequatur iure reiciendis,Vel omnis quaerat nemo dolorem eligendi est iure qui.,641,Hyllie beige,2,1
Lobby,BRATHULT,rerum distinctio dolores,Cupiditate distinctio architecto placeat dolorem id nostrum sunt laboriosam iure.,602,original red,26,2
Lobby,DELAKTIG,et tempora fuga,Atque ipsum aliquam.,193,gray,16,2
Living room,DELAKTIG,omnis at blanditiis,Molestiae et voluptates in earum et esse ut animi laborum.,590,black,28,1
Lobby,BALKARP,dolorum cupiditate eum,Et perspiciatis non rerum odit dolor.,172,gray,6,3
Rest room,DELAKTIG,dignissimos omnis et,Quod dolore cupiditate enim accusamus.,453,Hyllie dark gray,20,2
Bed room,BALKARP,minus et voluptas,Saepe voluptates vel perspiciatis aut.,406,navy,27,2
Lobby,EKEBOL,libero omnis fugiat,Quia ut assumenda officia modi dolores eum nemo excepturi.,128,Hyllie dark gray,24,1
Living room,EKEBOL,dolorem odit ut,Nemo ut sed itaque tempore quod facere ut.,21,black,25,3
Living room,BRATHULT,laborum sit tempora,Nam recusandae ipsa est ipsam incidunt omnis quae sapiente.,38,red,2,4
Living room,EKEBOL,est amet optio,Eveniet earum non.,58,Hyllie beige,19,1
Bed room,EKEBOL,fugit et et,Numquam qui error quidem enim quibusdam.,259,Hyllie dark gray,19,4
Living room,EKEBOL,sit quis est,Consequatur vel repellendus dolore hic quod doloremque est ea consequatur.,590,Bomstad black,17,4
Bed room,DELAKTIG,dolores amet nemo,Corrupti aspernatur dolorum veritatis praesentium deserunt.,207,Bomstad black,23,2
Kitchen,EKEBOL,architecto dolores at,Qui quos ab ut doloremque asperiores sequi facilis eius minima.,644,red,22,3
Lobby,EKEBOL,quos aut dolorem,Maiores saepe quisquam iusto laborum asperiores sint.,160,Bomstad black,5,1
Rest room,EKEBOL,ea quia qui,Placeat ea maxime.,180,white,16,5
Bed room,FRIHETEN,aut sit dolorem,Natus aut odit placeat ducimus ut.,234,black,2,1
Kitchen,BALKARP,atque ipsam omnis,Ullam aut eum cum unde sed veritatis.,50,white,24,5
Living room,BALKARP,ut alias ut,Modi suscipit expedita labore consequuntur et maxime.,178,Bomstad black,21,1
Lobby,BALKARP,expedita sit dolor,Est dignissimos ea similique in commodi.,358,navy,4,3
Lobby,EKEBOL,ratione eum itaque,Natus et accusamus esse eveniet enim.,296,Skiftebo blue,16,3
Lobby,EKEBOL,consequuntur consequuntur ut,Et aut quidem praesentium.,563,black,20,2
Rest room,EKEBOL,possimus nisi odio,Ut veniam deleniti at non dicta exercitationem autem incidunt.,452,pink,10,2
Rest room,EKEBOL,est molestiae iusto,Quisquam laboriosam magnam corrupti ipsa et harum.,571,red,27,2
Kitchen,EKEBOL,earum dolor modi,Cum quam autem rerum.,143,blue,6,2
Rest room,EKEBOL,non est ratione,Sint eum voluptatum.,81,white,1,2
Rest room,DELAKTIG,repellendus praesentium qui,Non fugit similique totam autem vel dolorem.,352,blue,9,4
Bed room,BALKARP,minus asperiores perspiciatis,Magni optio qui.,75,red,15,2
Bed room,DELAKTIG,voluptatem a accusamus,Aut aliquid delectus.,78,Hyllie beige,25,1
Living room,BALKARP,nihil soluta voluptatum,Dolore nam voluptas nostrum nesciunt beatae.,391,navy,5,3
Bed room,FRIHETEN,dolorem ipsum animi,Veniam quod totam aperiam impedit consequatur explicabo asperiores voluptatem.,585,white,6,4
Lobby,EKEBOL,eius sit omnis,Minus rerum saepe amet fugit dolorem.,550,navy,4,1
Lobby,BALKARP,qui amet repudiandae,Tempore ut aut omnis explicabo voluptatem.,52,Hyllie dark gray,30,4
Kitchen,BALKARP,quaerat adipisci ut,Dolorum est nemo est dolor nam porro pariatur.,661,Bomstad black,5,1
Living room,BRATHULT,qui error commodi,Est reprehenderit qui accusamus minima libero amet distinctio fuga deserunt.,375,red,28,4
Rest room,EKEBOL,ut facere laboriosam,Laboriosam temporibus officiis asperiores ipsum quis et est.,535,Bomstad black,16,5
Kitchen,EKEBOL,doloribus iste animi,Quam provident aut consectetur cumque eos quas.,273,Skiftebo dark gray,20,4
Living room,DELAKTIG,velit aut eaque,Dolores corrupti et maxime tempore et doloribus dicta molestias.,22,white,26,2
Rest room,EKEBOL,repudiandae quas omnis,Qui vel eaque.,348,red,1,5
Bed room,DELAKTIG,dignissimos nam similique,Aut saepe ut velit ipsa.,365,Bomstad black,26,2
Bed room,BALKARP,aut rerum aspernatur,Praesentium molestias deserunt quod illo necessitatibus debitis.,571,navy,14,4
Kitchen,BALKARP,similique non ab,Facilis esse numquam enim occaecati sunt aut est.,660,pink,6,4
Kitchen,BRATHULT,aut quis aut,Repellendus quisquam soluta architecto dolores ad sunt ad expedita.,271,Hyllie dark gray,6,5
Kitchen,BALKARP,possimus aut doloremque,Dolore suscipit deserunt fugiat doloribus aliquam eos dolor accusamus quisquam.,93,Skiftebo blue,17,3
Living room,EKEBOL,sapiente nam repellendus,Et sed illum quisquam aliquid dolorum sed et optio suscipit.,291,navy,17,5
Lobby,BALKARP,iste qui ut,Amet sint vel est consectetur neque nisi ipsam.,505,Bomstad black,3,4
Bed room,EKEBOL,possimus in autem,Velit ut sit vel fuga earum ea.,390,gray,27,2
Lobby,BRATHULT,quibusdam facilis ipsa,Ea mollitia eligendi voluptates consequatur qui.,126,Hyllie dark gray,1,3
Living room,BALKARP,sunt perferendis atque,Aut consectetur quis fugit reprehenderit autem nihil saepe.,113,navy,7,5
Living room,DELAKTIG,qui non natus,Sunt ullam eaque dolores doloribus sequi maiores.,198,Bomstad black,5,3
Bed room,BALKARP,omnis eaque et,Delectus consequatur quia maxime inventore quo mollitia et porro laboriosam.,457,white,2,4
Bed room,DELAKTIG,nihil ab fugit,Et optio quaerat quia nulla commodi id ex blanditiis.,563,Skiftebo blue,3,2
Bed room,EKEBOL,quia et eum,Quia sit eveniet laboriosam recusandae laboriosam.,159,Skiftebo dark gray,11,5
Bed room,BRATHULT,quis suscipit repellendus,Qui asperiores blanditiis.,543,Skiftebo blue,11,5
Living room,EKEBOL,accusantium ut accusantium,Quam placeat nulla hic sit.,88,pink,17,5
Rest room,EKEBOL,deleniti provident repellendus,Qui ut dicta molestiae.,467,blue,25,1
Living room,EKEBOL,saepe beatae tempore,Sed exercitationem possimus qui nisi recusandae illum consequatur maiores.,397,gray,5,1
Living room,BRATHULT,cum sit tempora,Nesciunt a voluptas ratione quia consequuntur qui sunt voluptates necessitatibus.,268,gray,22,5
Bed room,DELAKTIG,et dolorum similique,Ut iure eveniet culpa.,357,Skiftebo blue,17,1
Lobby,FRIHETEN,qui omnis omnis,Dignissimos maxime qui aut eos quo fuga debitis voluptas ratione.,260,Bomstad black,30,1
Bed room,FRIHETEN,voluptas aliquam cumque,Cum voluptatibus iste aut voluptas porro quos laborum consequatur.,131,navy,16,1
Living room,DELAKTIG,excepturi qui ratione,Rerum aspernatur nihil id provident modi alias et.,310,Hyllie dark gray,29,3
Rest room,DELAKTIG,eos quia tempore,Officiis qui laudantium.,583,pink,21,2
Bed room,BALKARP,tenetur sint repellat,Dolorem magni porro eligendi voluptas odit.,26,pink,26,4
Rest room,DELAKTIG,molestiae animi sapiente,Eos facere quo numquam eum ut tenetur.,241,Hyllie beige,7,3
Rest room,BRATHULT,voluptatem eaque dolorem,Fugit eum quo placeat est quidem dolores nostrum.,285,pink,21,3
Living room,EKEBOL,illum illo molestiae,Et ipsam quod.,581,Skiftebo dark gray,8,2
Living room,FRIHETEN,non odit quasi,Modi voluptas in rerum quas.,227,navy,10,3
Rest room,EKEBOL,odit consectetur repudiandae,Non non omnis.,235,original red,23,5
Rest room,BRATHULT,labore eos expedita,Quam similique quisquam nihil hic.,656,red,9,3
Living room,DELAKTIG,eligendi officiis in,Commodi et asperiores inventore et nisi.,312,Hyllie dark gray,24,5
Lobby,EKEBOL,saepe aut autem,Assumenda et facilis.,390,black,17,3
Living room,FRIHETEN,rerum provident officiis,Consequatur ut occaecati.,606,Hyllie dark gray,14,3
Lobby,DELAKTIG,ab debitis nulla,Fugiat asperiores consequuntur natus ab culpa.,331,black,4,1
Living room,BALKARP,error eos sint,Omnis sunt dicta ad consequatur doloribus corrupti sint dicta.,540,white,2,1
Bed room,BRATHULT,vel illum voluptas,Occaecati numquam eos in nam sed rerum.,298,Skiftebo blue,7,1
Kitchen,FRIHETEN,doloremque qui voluptatem,Dolore et soluta doloribus amet quis qui.,207,Hyllie dark gray,15,5
Lobby,BRATHULT,provident natus consectetur,Voluptas debitis necessitatibus sed nostrum.,526,Skiftebo dark gray,20,4
Lobby,DELAKTIG,in sunt autem,Est dicta aut aut hic aut non doloremque consequatur error.,77,navy,11,1
Bed room,EKEBOL,aliquid minus doloremque,Nihil voluptates quia voluptatem voluptas soluta.,195,Skiftebo blue,4,5
Rest room,EKEBOL,hic inventore id,Et numquam natus ut iure laudantium consequatur.,302,Hyllie beige,10,5
Bed room,EKEBOL,vitae ex qui,Totam ad ut aut quo dolorem ut enim qui pariatur.,246,Hyllie dark gray,27,3
Lobby,FRIHETEN,nobis autem sint,Aliquid error magni quia dolores sint illum molestiae.,470,Bomstad black,14,4
Rest room,FRIHETEN,velit inventore quia,Ea ut voluptatem architecto.,516,Skiftebo blue,3,4
Kitchen,BALKARP,eveniet provident et,Et aut vel et officia dolore vel.,265,red,14,5
Kitchen,BRATHULT,sed debitis autem,Necessitatibus ipsam quisquam unde omnis et iste itaque fugiat est.,471,white,4,5
Lobby,DELAKTIG,et est animi,Nulla sed iusto eos voluptas dicta quos nihil quam.,171,Skiftebo dark gray,3,2
Lobby,EKEBOL,et quibusdam placeat,Explicabo iusto id.,307,red,5,1
Rest room,DELAKTIG,vero omnis exercitationem,Architecto minima est hic quia in quod alias sit.,76,red,7,1
Living room,BALKARP,veritatis voluptas porro,Quia quia pariatur non illo voluptas sint.,351,Bomstad black,10,1
Living room,FRIHETEN,rerum voluptas blanditiis,Vel mollitia qui et nisi consequatur.,36,Skiftebo dark gray,2,4
Lobby,BALKARP,quam harum autem,Non rerum necessitatibus maiores ut occaecati.,289,white,21,2
Bed room,DELAKTIG,expedita laudantium amet,Ipsa beatae ipsa error a ullam quasi.,387,red,13,2
Kitchen,BALKARP,blanditiis esse non,Aut sed omnis.,123,gray,13,2
Lobby,BRATHULT,enim eos facilis,Nemo soluta ab similique sit omnis maiores laudantium quo rerum.,645,Skiftebo dark gray,1,1
Bed room,DELAKTIG,dicta ut voluptas,In perspiciatis fugit consequatur nulla occaecati doloremque reiciendis molestiae et.,533,Skiftebo dark gray,25,1
Bed room,BALKARP,omnis esse autem,Consequatur voluptatem ea corporis ex inventore.,52,Skiftebo dark gray,24,1
Lobby,FRIHETEN,reiciendis placeat aliquam,Nam consequatur est eveniet ratione autem tenetur magnam.,545,original red,18,3
Bed room,EKEBOL,autem tempore beatae,Explicabo delectus dignissimos in similique molestiae ipsa aut et.,307,gray,15,1
Living room,DELAKTIG,aut aut ut,Omnis quia sed soluta amet facere quis nihil consequatur.,537,black,6,2
Kitchen,EKEBOL,optio et deleniti,Quisquam voluptatum tempore ea ipsam velit quas repellendus qui.,529,pink,11,3
Lobby,FRIHETEN,necessitatibus vitae non,Autem doloribus rerum ullam saepe ratione.,345,Bomstad black,15,4
Living room,BRATHULT,labore ipsum ducimus,Nisi nemo doloremque consequatur aut dolor rerum nobis eos.,251,Hyllie dark gray,7,4
Living room,BALKARP,sit voluptates quod,Quam quisquam modi asperiores quibusdam commodi quia ut perferendis aliquam.,630,Hyllie beige,30,5
Rest room,BALKARP,eos sunt suscipit,Sit ad omnis et aut omnis esse doloribus ex.,385,Skiftebo dark gray,3,2
Lobby,FRIHETEN,debitis repellendus ratione,Est id aperiam impedit consequatur fuga nihil.,53,pink,26,4
Rest room,EKEBOL,autem in quae,Id neque architecto.,503,Bomstad black,5,3
Rest room,BRATHULT,aut velit vel,Tempore placeat aut enim quia quia velit qui corporis.,332,blue,17,3
Lobby,DELAKTIG,expedita et tenetur,Ex cum natus eius quae consectetur illum.,414,pink,9,5
Rest room,FRIHETEN,dolor sed itaque,Ex perferendis omnis alias ullam ipsum quia.,400,blue,26,4
Lobby,BALKARP,dolores laboriosam sed,Laboriosam voluptatem iste qui possimus sint.,122,red,29,3
Bed room,BALKARP,nobis similique sit,Aliquam architecto deleniti qui consequatur et optio placeat consectetur.,616,Bomstad black,15,2
Living room,DELAKTIG,eum reprehenderit dolorum,Aperiam enim veniam.,139,pink,13,1
Rest room,EKEBOL,perferendis ut et,Qui et ipsa.,342,Skiftebo blue,2,5
Rest room,BALKARP,suscipit dignissimos ut,Labore a voluptatum sunt cum et.,496,pink,15,2
Lobby,BALKARP,ad architecto similique,Nemo quibusdam nulla ea et porro eveniet.,18,blue,2,4
Lobby,BRATHULT,in placeat nobis,Odit quia et cupiditate totam voluptatibus ipsam sunt et iusto.,451,Hyllie dark gray,20,5
Bed room,BRATHULT,possimus occaecati similique,Mollitia fugiat aut voluptatem et aliquam provident.,308,Hyllie dark gray,18,2
Bed room,BRATHULT,debitis magni fuga,Vel sed minus et ratione.,461,original red,9,5
Rest room,BRATHULT,voluptas dolores autem,Aut in iusto aut et saepe qui ullam.,77,black,3,4
Rest room,EKEBOL,consequuntur fuga minima,Asperiores expedita quia aperiam sapiente unde non neque inventore placeat.,260,black,7,3
Living room,BALKARP,minus enim minus,Quam dicta dolores autem sed maiores in ipsam sunt.,434,navy,10,5
Kitchen,BALKARP,molestias rerum commodi,Neque autem doloribus libero sunt id tenetur ea accusamus.,250,white,26,5
Living room,EKEBOL,sed soluta et,Illo natus fuga debitis esse cumque similique velit quas.,470,Hyllie beige,26,2
Rest room,EKEBOL,commodi quia vitae,Qui quod a.,628,original red,26,3
Kitchen,FRIHETEN,nesciunt consequatur aut,Perferendis cumque dolores soluta exercitationem.,21,black,24,1
Lobby,BRATHULT,sed recusandae similique,Aperiam ullam minus illo molestiae omnis explicabo.,520,navy,6,4
Kitchen,BALKARP,omnis ullam et,Molestiae tenetur quam et architecto nulla.,519,Hyllie dark gray,26,5
Kitchen,DELAKTIG,quia provident ipsum,Molestiae facilis aliquam doloribus rerum culpa doloribus ut.,288,red,26,1
Bed room,BALKARP,corrupti omnis consequatur,Voluptas et voluptas rerum incidunt aut quod libero quia eaque.,400,pink,17,1
Living room,BRATHULT,cumque rerum libero,Natus in incidunt error illo consequatur.,424,Hyllie beige,9,1
Lobby,FRIHETEN,ut quia qui,Placeat error quod voluptas.,74,original red,19,2
Bed room,BALKARP,ullam esse quos,Commodi voluptatibus alias illum dolores iure velit.,648,red,10,4
Rest room,DELAKTIG,et quia ut,Fuga qui necessitatibus earum porro fuga voluptatem voluptatem.,431,Skiftebo blue,7,5
Kitchen,BALKARP,assumenda doloribus illum,Consequuntur consequatur ducimus consequuntur rerum dicta velit incidunt.,279,Skiftebo blue,12,3
Lobby,EKEBOL,doloremque earum cupiditate,Ut cum reiciendis molestiae rerum corporis officia quas.,658,Skiftebo blue,5,1
Lobby,EKEBOL,labore vitae delectus,Aliquid facere rerum nisi enim rerum amet.,102,red,21,2
Kitchen,BRATHULT,quia qui quae,Voluptatem facilis ut consequatur minima.,554,navy,4,1
Lobby,DELAKTIG,ut quidem ipsam,Et dicta saepe.,611,Hyllie dark gray,26,4
Living room,BRATHULT,quos officiis earum,Pariatur quidem ullam in.,82,blue,6,3
Lobby,FRIHETEN,non explicabo omnis,Debitis nulla quae et aspernatur laborum rerum odit sit.,36,navy,12,1
Bed room,BRATHULT,odit eos sint,Numquam aspernatur et vel quia earum qui deserunt.,155,navy,12,4
Kitchen,FRIHETEN,eveniet ut necessitatibus,Voluptas similique atque corrupti repellendus vitae nulla error.,227,black,12,4
Bed room,DELAKTIG,fuga non aut,Facere possimus dolorem ut quisquam minus omnis culpa repellendus eum.,504,gray,27,3
Kitchen,FRIHETEN,soluta aut a,Qui recusandae eius qui repudiandae.,551,Skiftebo blue,14,1
Bed room,BALKARP,omnis voluptas eum,Quia quae qui et quia cumque.,446,navy,24,5
Lobby,EKEBOL,et commodi labore,Est cumque minus.,615,white,13,1
Kitchen,FRIHETEN,blanditiis sunt natus,Quasi ipsa qui est ut.,377,pink,13,2
Bed room,DELAKTIG,explicabo quaerat minus,Enim eum ut et consequatur.,646,original red,23,3
Rest room,BALKARP,quasi et nihil,Rerum pariatur ex quas omnis voluptatum debitis quae consequatur.,340,Hyllie dark gray,13,4
Bed room,EKEBOL,in iure et,Labore sed illo corrupti quo ut quisquam dolores.,498,pink,5,2
Bed room,BALKARP,quos nam autem,Quia debitis sit expedita quod atque quasi et.,502,original red,12,2
Kitchen,BALKARP,ratione dolore rerum,Tenetur reiciendis voluptas.,13,Skiftebo dark gray,30,4
Rest room,EKEBOL,amet aut animi,Quia quod qui ullam sapiente necessitatibus magni nihil.,319,pink,8,5
Kitchen,BRATHULT,laboriosam ad magni,Repellat pariatur doloremque aut totam quis ea eligendi.,93,red,10,5
Rest room,EKEBOL,rerum doloremque suscipit,Esse consequuntur amet nihil vero voluptatem vel dolores at sequi.,52,Skiftebo dark gray,27,4
Lobby,DELAKTIG,maxime illum id,Molestiae rerum nihil consequatur porro.,198,original red,23,4
Bed room,DELAKTIG,atque ipsa debitis,Saepe suscipit incidunt ab debitis quis est id.,644,Bomstad black,2,1
Rest room,BRATHULT,error accusantium asperiores,Earum vel qui fugit dolor.,389,original red,19,5
Lobby,BALKARP,excepturi modi aut,Unde est fuga rerum et.,24,white,21,1
Living room,FRIHETEN,rerum perferendis est,Tempore sint et fugit inventore rem quae ullam nihil.,57,Bomstad black,16,3
Bed room,FRIHETEN,ipsam non sit,Non dolorum laboriosam et asperiores.,72,original red,28,4
Rest room,EKEBOL,nemo velit et,Dolorem tempore accusamus sint et.,401,Skiftebo dark gray,26,3
Living room,DELAKTIG,ea at sed,Veniam impedit dignissimos laboriosam molestias animi.,358,blue,5,1
Lobby,BALKARP,eligendi dolor velit,Dolorem ipsum est unde iure excepturi in ab.,223,red,26,3
Rest room,EKEBOL,mollitia molestiae reiciendis,Aut aut voluptatem enim eum consequatur harum nam suscipit.,459,Skiftebo blue,26,1
Lobby,DELAKTIG,voluptates voluptatem minima,Eum suscipit et magni sint et et.,332,pink,17,3
Rest room,EKEBOL,praesentium enim ducimus,Alias vel enim.,481,red,7,1
Lobby,DELAKTIG,velit in ullam,Qui ullam impedit vero sequi reiciendis praesentium.,28,navy,12,1
Bed room,EKEBOL,qui numquam mollitia,Nesciunt dolorem omnis nesciunt pariatur.,573,pink,5,1
Living room,BRATHULT,mollitia incidunt alias,Minima molestias tempora deleniti laboriosam quia.,184,red,28,5
Lobby,DELAKTIG,voluptates tenetur suscipit,Esse omnis dolorem.,612,red,24,2
Rest room,DELAKTIG,illo nobis necessitatibus,Tempora aut quo in assumenda molestias commodi nulla officiis tempora.,348,Hyllie dark gray,25,4
Living room,DELAKTIG,autem et voluptatem,Illum ut deserunt non consequatur aliquam quam sed.,118,pink,27,3
Living room,BALKARP,facere voluptatem repellendus,Ullam beatae voluptates deleniti esse deleniti tempora magni ut qui.,399,Skiftebo blue,8,5
Kitchen,EKEBOL,illum facere nisi,Voluptatem doloremque officia.,57,pink,2,5
Kitchen,BALKARP,asperiores perferendis optio,Similique ratione quia.,62,gray,5,3
Living room,BALKARP,rem ut ut,Aut dolor qui.,407,red,28,1
Lobby,EKEBOL,tempora quos qui,Ipsum omnis maiores delectus quas facere.,79,pink,25,5
Living room,DELAKTIG,optio inventore eum,Id corporis placeat eos eum doloremque ut distinctio.,185,Skiftebo blue,21,1
Living room,BRATHULT,magnam non quasi,A voluptatem nisi rerum aut possimus.,612,gray,22,1
Living room,BRATHULT,atque labore cumque,Tempora aut suscipit minus quia.,342,original red,18,2
Kitchen,EKEBOL,sed quis sit,Voluptas eos sed omnis.,135,pink,23,1
Lobby,DELAKTIG,ut possimus et,Voluptates nemo magni.,15,red,4,3
Kitchen,BRATHULT,eos dolor voluptatem,Dolor quaerat ut.,256,blue,26,1
Living room,BRATHULT,totam delectus asperiores,Impedit non dolores rem dolore voluptas aut nam accusantium quia.,476,Skiftebo blue,16,1
Rest room,DELAKTIG,voluptatem in qui,Odit cumque consequuntur sint aliquid quo fuga incidunt.,125,gray,7,1
Living room,FRIHETEN,nihil dolor culpa,Et rem ex beatae quis sed.,391,original red,29,2
Rest room,EKEBOL,at blanditiis cum,Dolor similique eius est et nostrum cumque perferendis similique consectetur.,522,original red,24,2
Kitchen,BRATHULT,vitae omnis doloribus,Iusto ad reprehenderit vel aperiam vero repellendus iusto.,111,Skiftebo dark gray,15,3
Bed room,BRATHULT,aperiam soluta corrupti,Deserunt beatae consequatur cumque natus quis blanditiis aut.,519,Hyllie dark gray,15,3
Bed room,EKEBOL,ut qui dolores,Eligendi id dicta consequatur fugiat eum et.,116,gray,10,1
Kitchen,BALKARP,ipsam nihil tempore,Error rerum temporibus sequi id.,282,navy,14,5
Living room,FRIHETEN,sint similique cupiditate,Animi qui quam et facilis.,640,blue,22,3
Bed room,BRATHULT,repellat perspiciatis minus,Similique mollitia magnam earum quas ipsum deleniti vel et.,97,Skiftebo dark gray,30,3
Lobby,EKEBOL,est neque eum,Modi deleniti maxime est ullam.,592,navy,25,2
Lobby,FRIHETEN,temporibus esse omnis,Doloribus dolor inventore beatae perferendis minus ea adipisci aut.,300,red,15,5
Kitchen,BRATHULT,aliquam reprehenderit est,Non ut rerum quia nihil cupiditate.,652,pink,10,4
Rest room,DELAKTIG,aut quas voluptatem,Non rerum voluptas optio beatae magni et.,135,Skiftebo blue,16,5
Kitchen,EKEBOL,veritatis quia vitae,Temporibus consequatur iusto ea.,191,pink,23,4
Rest room,DELAKTIG,est amet esse,Dolor velit magni amet laborum nostrum totam possimus et qui.,150,blue,6,1
Bed room,DELAKTIG,qui voluptates quia,Rerum ab ratione facere nesciunt officia consequatur.,272,navy,7,5
Bed room,BRATHULT,quisquam quia ipsum,Perspiciatis quis blanditiis neque deleniti amet amet.,23,red,15,3
Living room,BALKARP,odio dolores laborum,Illum hic eum non omnis itaque dolore maxime laborum molestiae.,54,red,18,4
Lobby,EKEBOL,labore optio veritatis,Officia sed in.,176,pink,16,2
Lobby,BRATHULT,pariatur ad hic,Voluptate earum saepe quidem error.,214,navy,6,5
Kitchen,DELAKTIG,explicabo est sed,Exercitationem aperiam recusandae et inventore.,384,original red,18,2
Living room,BRATHULT,ut necessitatibus aut,Qui incidunt perferendis quas.,446,Hyllie dark gray,11,2
Bed room,FRIHETEN,voluptates rerum consequatur,Ratione reiciendis veniam aspernatur harum facere laboriosam.,491,Skiftebo dark gray,16,2
Bed room,BALKARP,quibusdam cupiditate porro,Et omnis voluptates.,217,red,1,5
Rest room,BALKARP,architecto fugiat sint,Ab tempora cumque nihil et.,614,original red,27,2
Living room,DELAKTIG,non eius vel,Explicabo et in quia doloribus.,353,black,3,1
Bed room,BRATHULT,aut et architecto,Et sunt quibusdam et.,526,white,12,2
Bed room,DELAKTIG,ab ea nulla,Iste et impedit veniam optio at amet repudiandae amet.,343,Skiftebo dark gray,6,3
Rest room,EKEBOL,sunt reprehenderit velit,Ex et consectetur hic.,556,Skiftebo blue,23,1
Rest room,FRIHETEN,aperiam ut harum,Consequuntur nemo quod molestiae qui laudantium dolores et atque vitae.,147,gray,18,4
Rest room,FRIHETEN,minima quia et,Nesciunt quo suscipit temporibus.,260,red,13,4
Kitchen,BRATHULT,autem quis nemo,Consectetur delectus esse magni vel.,297,original red,1,5
Bed room,BALKARP,unde tempore eius,Beatae est veritatis fuga impedit consectetur fugit laborum.,251,Bomstad black,27,1
Living room,EKEBOL,eos voluptatem voluptatibus,Autem itaque quia aliquid nulla rerum voluptatem optio quae accusamus.,568,Skiftebo blue,4,5
Living room,FRIHETEN,distinctio dolorem beatae,Et quia facere eveniet quasi velit error illo.,441,pink,28,1
Rest room,BALKARP,esse iusto laboriosam,Dolorem et facere tempore voluptate quo.,328,white,8,2
Bed room,FRIHETEN,voluptatem ullam expedita,Delectus est recusandae quidem quos nulla exercitationem.,201,white,9,5
Kitchen,FRIHETEN,rerum quia consequatur,Corrupti vel eos harum accusamus natus necessitatibus veritatis.,495,black,14,2
Living room,DELAKTIG,voluptas qui molestiae,Non deleniti et itaque maiores aperiam reiciendis aut.,553,Hyllie dark gray,18,3
Kitchen,FRIHETEN,ad eos hic,Consequatur aut autem culpa sunt id aliquid labore et.,487,blue,21,2
Lobby,EKEBOL,consequatur cupiditate aliquid,Reiciendis aliquam earum repudiandae quia voluptas.,308,blue,3,5
Lobby,EKEBOL,quis quia et,Reprehenderit doloribus reprehenderit.,331,gray,8,5
Living room,EKEBOL,adipisci adipisci voluptatibus,Ad libero debitis.,144,Hyllie beige,1,1
Kitchen,BRATHULT,et natus officia,Sit temporibus eum ut magni dicta magni ipsum vel.,17,Hyllie dark gray,30,5
Lobby,BRATHULT,fugit ut sint,Modi et placeat qui laborum adipisci corrupti aut repellendus.,402,Bomstad black,16,2
Lobby,DELAKTIG,ut qui culpa,Ut qui ut et in possimus non culpa rerum in.,366,black,12,5
Bed room,BALKARP,neque vero quasi,Similique consectetur in tenetur ut minima dolore quas fugiat aspernatur.,598,Skiftebo blue,9,2
Rest room,DELAKTIG,earum fugiat aut,Distinctio vel error qui dignissimos.,27,Skiftebo dark gray,23,1
Kitchen,EKEBOL,et natus id,Quis reiciendis nobis perspiciatis minus ut iure consectetur velit.,348,Hyllie dark gray,11,5
Lobby,EKEBOL,deserunt eos deserunt,Est possimus nam a.,128,red,1,3
Rest room,FRIHETEN,at quos aliquam,Qui nemo dolorem sint ab sed.,296,red,5,3
Lobby,BALKARP,eaque sint earum,Aut consequatur est.,494,gray,8,2
